{
  "schema_version": "1.0",
  "backup_id": "45000000-0000-4000-8000-000000000001",
  "created_at": "2026-07-24T03:00:00Z",
  "classification": "SYNTHETIC_DEV_ONLY",
  "source_checkpoint": {
    "alembic_version": "0004_imp045",
    "postgres_checkpoint_at": "2026-07-24T03:00:00Z",
    "aistor_image_ref": "RELEASE.2026-06-06T02-44-06Z",
    "redis_is_business_truth": false
  },
  "database_inventory": {
    "organization_count": 1,
    "asset_count": 1,
    "audit_job_count": 1,
    "finding_count": 0,
    "finding_lineage_sha256": "aaaaaaaaaaaaaaaaaaaaaaaaaaaaaaaaaaaaaaaaaaaaaaaaaaaaaaaaaaaaaaaa",
    "artifact_count": 1,
    "artifact_inventory_sha256": "bbbbbbbbbbbbbbbbbbbbbbbbbbbbbbbbbbbbbbbbbbbbbbbbbbbbbbbbbbbbbbbb"
  },
  "object_inventory": [
    {
      "artifact_id": "45000000-0000-4000-8000-000000000002",
      "bucket": "secai-imp045-synthetic",
      "object_key": "synthetic/45000000-0000-4000-8000-000000000002/artifact.bin",
      "source_version_id": "synthetic-version-id",
      "sha256": "cccccccccccccccccccccccccccccccccccccccccccccccccccccccccccccccc",
      "size_bytes": 64,
      "backup_file": "objects/45000000-0000-4000-8000-000000000002.bin"
    }
  ],
  "recovery_targets": {
    "postgres_rpo_seconds": 900,
    "postgres_rto_seconds": 14400,
    "evidence_rpo_seconds": 3600,
    "evidence_rto_seconds": 28800,
    "independent_failure_domain_required": true
  }
}
